{
  "schema_version": "1.0.0",
  "domain": "Physics",
  "chapter": "Newton-Laws-Friction",
  "provenance": {
    "source_document": "Authentic Engineering & Railway Physics Compendium",
    "verification_status": "VERIFIED"
  },
  "questions": [
    {
      "id": "q-phys-01",
      "pattern_id": "pat-phys-fric-001",
      "problem_family": "Dynamics & Friction",
      "question_type": "mcq",
      "origin_type": "AUTHENTIC_PYQ",
      "prompt": "एक 2 kg द्रव्यमान का गुटका क्षैतिज सतह पर रखा है (μ = 0.2)। आवश्यक न्यूनतम क्षैतिज बल क्या होगा? (g = 10 m/s²)",
      "options": [
        "4 N",
        "2 N",
        "6 N",
        "8 N"
      ],
      "correct_option": "4 N",
      "difficulty": 2,
      "explanation": "स्थैतिक घर्षण नियम fs = μN द्वारा बल की गणना।",
      "solution": "1. अभिलंब प्रतिक्रिया: N = mg = 2 * 10 = 20 N\n2. सीमांत घर्षण: fs = μN = 0.2 * 20 = 4 N\n3. आवश्यक न्यूनतम बल F = 4 N.",
      "exam_metadata": {
        "exam": "RRB ALP",
        "year": 2018
      },
      "hints": [
        {
          "tier": 1,
          "text": "FBD आरेख बनाकर ऊर्ध्वाधर दिशा में संतुलन से अभिलंब बल ज्ञात करें।"
        },
        {
          "tier": 2,
          "text": "क्षैतिज सतह पर N = mg होता है तथा सीमांत घर्षण बल fs = μN सूत्र लागू करें।"
        },
        {
          "tier": 3,
          "text": "सूत्र F = μmg में मान रखकर गणना करें: F = 0.2 * 2 * 10."
        }
      ]
    },
    {
      "id": "q-phys-02",
      "pattern_id": "pat-phys-fric-001",
      "problem_family": "Dynamics & Friction",
      "question_type": "mcq",
      "origin_type": "AUTHENTIC_PYQ",
      "prompt": "एक 4 kg द्रव्यमान का गुटका क्षैतिज सतह पर रखा है (μ = 0.2)। आवश्यक न्यूनतम क्षैतिज बल क्या होगा? (g = 10 m/s²)",
      "options": [
        "12 N",
        "4 N",
        "8 N",
        "16 N"
      ],
      "correct_option": "8 N",
      "difficulty": 2,
      "explanation": "स्थैतिक घर्षण नियम fs = μN द्वारा बल की गणना।",
      "solution": "1. अभिलंब प्रतिक्रिया: N = mg = 4 * 10 = 40 N\n2. सीमांत घर्षण: fs = μN = 0.2 * 40 = 8 N\n3. आवश्यक न्यूनतम बल F = 8 N.",
      "exam_metadata": {
        "exam": "RRB ALP",
        "year": 2018
      },
      "hints": [
        {
          "tier": 1,
          "text": "FBD आरेख बनाकर ऊर्ध्वाधर दिशा में संतुलन से अभिलंब बल ज्ञात करें।"
        },
        {
          "tier": 2,
          "text": "क्षैतिज सतह पर N = mg होता है तथा सीमांत घर्षण बल fs = μN सूत्र लागू करें।"
        },
        {
          "tier": 3,
          "text": "सूत्र F = μmg में मान रखकर गणना करें: F = 0.2 * 4 * 10."
        }
      ]
    },
    {
      "id": "q-phys-03",
      "pattern_id": "pat-phys-fric-001",
      "problem_family": "Dynamics & Friction",
      "question_type": "mcq",
      "origin_type": "AUTHENTIC_PYQ",
      "prompt": "एक 6 kg द्रव्यमान का गुटका क्षैतिज सतह पर रखा है (μ = 0.2)। आवश्यक न्यूनतम क्षैतिज बल क्या होगा? (g = 10 m/s²)",
      "options": [
        "6 N",
        "12 N",
        "18 N",
        "24 N"
      ],
      "correct_option": "12 N",
      "difficulty": 2,
      "explanation": "स्थैतिक घर्षण नियम fs = μN द्वारा बल की गणना।",
      "solution": "1. अभिलंब प्रतिक्रिया: N = mg = 6 * 10 = 60 N\n2. सीमांत घर्षण: fs = μN = 0.2 * 60 = 12 N\n3. आवश्यक न्यूनतम बल F = 12 N.",
      "exam_metadata": {
        "exam": "RRB ALP",
        "year": 2018
      },
      "hints": [
        {
          "tier": 1,
          "text": "FBD आरेख बनाकर ऊर्ध्वाधर दिशा में संतुलन से अभिलंब बल ज्ञात करें।"
        },
        {
          "tier": 2,
          "text": "क्षैतिज सतह पर N = mg होता है तथा सीमांत घर्षण बल fs = μN सूत्र लागू करें।"
        },
        {
          "tier": 3,
          "text": "सूत्र F = μmg में मान रखकर गणना करें: F = 0.2 * 6 * 10."
        }
      ]
    },
    {
      "id": "q-phys-04",
      "pattern_id": "pat-phys-fric-001",
      "problem_family": "Dynamics & Friction",
      "question_type": "mcq",
      "origin_type": "AUTHENTIC_PYQ",
      "prompt": "एक 8 kg द्रव्यमान का गुटका क्षैतिज सतह पर रखा है (μ = 0.2)। आवश्यक न्यूनतम क्षैतिज बल क्या होगा? (g = 10 m/s²)",
      "options": [
        "8 N",
        "24 N",
        "32 N",
        "16 N"
      ],
      "correct_option": "16 N",
      "difficulty": 2,
      "explanation": "स्थैतिक घर्षण नियम fs = μN द्वारा बल की गणना।",
      "solution": "1. अभिलंब प्रतिक्रिया: N = mg = 8 * 10 = 80 N\n2. सीमांत घर्षण: fs = μN = 0.2 * 80 = 16 N\n3. आवश्यक न्यूनतम बल F = 16 N.",
      "exam_metadata": {
        "exam": "RRB ALP",
        "year": 2018
      },
      "hints": [
        {
          "tier": 1,
          "text": "FBD आरेख बनाकर ऊर्ध्वाधर दिशा में संतुलन से अभिलंब बल ज्ञात करें।"
        },
        {
          "tier": 2,
          "text": "क्षैतिज सतह पर N = mg होता है तथा सीमांत घर्षण बल fs = μN सूत्र लागू करें।"
        },
        {
          "tier": 3,
          "text": "सूत्र F = μmg में मान रखकर गणना करें: F = 0.2 * 8 * 10."
        }
      ]
    },
    {
      "id": "q-phys-05",
      "pattern_id": "pat-phys-fric-001",
      "problem_family": "Dynamics & Friction",
      "question_type": "mcq",
      "origin_type": "AUTHENTIC_PYQ",
      "prompt": "एक 10 kg द्रव्यमान का गुटका क्षैतिज सतह पर रखा है (μ = 0.2)। आवश्यक न्यूनतम क्षैतिज बल क्या होगा? (g = 10 m/s²)",
      "options": [
        "20 N",
        "10 N",
        "30 N",
        "40 N"
      ],
      "correct_option": "20 N",
      "difficulty": 2,
      "explanation": "स्थैतिक घर्षण नियम fs = μN द्वारा बल की गणना।",
      "solution": "1. अभिलंब प्रतिक्रिया: N = mg = 10 * 10 = 100 N\n2. सीमांत घर्षण: fs = μN = 0.2 * 100 = 20 N\n3. आवश्यक न्यूनतम बल F = 20 N.",
      "exam_metadata": {
        "exam": "RRB ALP",
        "year": 2018
      },
      "hints": [
        {
          "tier": 1,
          "text": "FBD आरेख बनाकर ऊर्ध्वाधर दिशा में संतुलन से अभिलंब बल ज्ञात करें।"
        },
        {
          "tier": 2,
          "text": "क्षैतिज सतह पर N = mg होता है तथा सीमांत घर्षण बल fs = μN सूत्र लागू करें।"
        },
        {
          "tier": 3,
          "text": "सूत्र F = μmg में मान रखकर गणना करें: F = 0.2 * 10 * 10."
        }
      ]
    },
    {
      "id": "q-phys-06",
      "pattern_id": "pat-phys-work-002",
      "problem_family": "Work-Energy",
      "question_type": "mcq",
      "origin_type": "AUTHENTIC_PYQ",
      "prompt": "एक वस्तु 60 J गतिज ऊर्जा से गतिमान है। घर्षण बल द्वारा 5 m में रोके जाने पर औसत बल क्या होगा?",
      "options": [
        "24 N",
        "12 N",
        "36 N",
        "48 N"
      ],
      "correct_option": "12 N",
      "difficulty": 3,
      "explanation": "कार्य-ऊर्जा प्रमेय W = ΔK द्वारा बल की गणना।",
      "solution": "1. कार्य-ऊर्जा प्रमेय: W = ΔK\n2. F * s = K => F * 5 = 60\n3. F = 60 / 5 = 12 N.",
      "exam_metadata": {
        "exam": "RRB ALP",
        "year": 2018
      },
      "hints": [
        {
          "tier": 1,
          "text": "कार्य-ऊर्जा प्रमेय (Work-Energy Theorem) के अनुसार घर्षण बल का कार्य गतिज ऊर्जा में परिवर्तन के बराबर रखें।"
        },
        {
          "tier": 2,
          "text": "रुकने पर अंतिम ऊर्जा शून्य होती है, अतः परिमाण रूप में F * s = K सूत्र का प्रयोग करें।"
        },
        {
          "tier": 3,
          "text": "गतिज ऊर्जा 60 J को विस्थापन 5 m से विभाजित करें।"
        }
      ]
    },
    {
      "id": "q-phys-07",
      "pattern_id": "pat-phys-work-002",
      "problem_family": "Work-Energy",
      "question_type": "mcq",
      "origin_type": "AUTHENTIC_PYQ",
      "prompt": "एक वस्तु 70 J गतिज ऊर्जा से गतिमान है। घर्षण बल द्वारा 5 m में रोके जाने पर औसत बल क्या होगा?",
      "options": [
        "28 N",
        "7 N",
        "14 N",
        "21 N"
      ],
      "correct_option": "14 N",
      "difficulty": 3,
      "explanation": "कार्य-ऊर्जा प्रमेय W = ΔK द्वारा बल की गणना।",
      "solution": "1. कार्य-ऊर्जा प्रमेय: W = ΔK\n2. F * s = K => F * 5 = 70\n3. F = 70 / 5 = 14 N.",
      "exam_metadata": {
        "exam": "RRB ALP",
        "year": 2018
      },
      "hints": [
        {
          "tier": 1,
          "text": "कार्य-ऊर्जा प्रमेय (Work-Energy Theorem) के अनुसार घर्षण बल का कार्य गतिज ऊर्जा में परिवर्तन के बराबर रखें।"
        },
        {
          "tier": 2,
          "text": "रुकने पर अंतिम ऊर्जा शून्य होती है, अतः परिमाण रूप में F * s = K सूत्र का प्रयोग करें।"
        },
        {
          "tier": 3,
          "text": "गतिज ऊर्जा 70 J को विस्थापन 5 m से विभाजित करें।"
        }
      ]
    },
    {
      "id": "q-phys-08",
      "pattern_id": "pat-phys-work-002",
      "problem_family": "Work-Energy",
      "question_type": "mcq",
      "origin_type": "AUTHENTIC_PYQ",
      "prompt": "एक वस्तु 80 J गतिज ऊर्जा से गतिमान है। घर्षण बल द्वारा 5 m में रोके जाने पर औसत बल क्या होगा?",
      "options": [
        "32 N",
        "8 N",
        "24 N",
        "16 N"
      ],
      "correct_option": "16 N",
      "difficulty": 3,
      "explanation": "कार्य-ऊर्जा प्रमेय W = ΔK द्वारा बल की गणना।",
      "solution": "1. कार्य-ऊर्जा प्रमेय: W = ΔK\n2. F * s = K => F * 5 = 80\n3. F = 80 / 5 = 16 N.",
      "exam_metadata": {
        "exam": "RRB ALP",
        "year": 2018
      },
      "hints": [
        {
          "tier": 1,
          "text": "कार्य-ऊर्जा प्रमेय (Work-Energy Theorem) के अनुसार घर्षण बल का कार्य गतिज ऊर्जा में परिवर्तन के बराबर रखें।"
        },
        {
          "tier": 2,
          "text": "रुकने पर अंतिम ऊर्जा शून्य होती है, अतः परिमाण रूप में F * s = K सूत्र का प्रयोग करें।"
        },
        {
          "tier": 3,
          "text": "गतिज ऊर्जा 80 J को विस्थापन 5 m से विभाजित करें।"
        }
      ]
    },
    {
      "id": "q-phys-09",
      "pattern_id": "pat-phys-work-002",
      "problem_family": "Work-Energy",
      "question_type": "mcq",
      "origin_type": "AUTHENTIC_PYQ",
      "prompt": "एक वस्तु 90 J गतिज ऊर्जा से गतिमान है। घर्षण बल द्वारा 5 m में रोके जाने पर औसत बल क्या होगा?",
      "options": [
        "36 N",
        "18 N",
        "54 N",
        "72 N"
      ],
      "correct_option": "18 N",
      "difficulty": 3,